Date	Incident Type	Applicant Name	Education Applicant	Number of Projects	Federal Share Obligated
1999-07-20	Severe Storm(s)	CLARK (COUNTY)	No	130	$3,714,093.05
1999-07-20	Severe Storm(s)	CLARK COUNTY SANITATION DIST	No	1	$1,841.49
1999-07-20	Severe Storm(s)	CLARK COUNTY SCHOOL DISTRICT	Yes	9	$65,394.21
1999-07-20	Severe Storm(s)	LAS VEGAS, CITY OF	No	41	$654,913.56
1999-07-20	Severe Storm(s)	LAS VEGAS METROPOLITAN POLICE DEPARTMENT	No	1	$8,391.45
1999-07-20	Severe Storm(s)	LAS VEGAS VALLEY WATER DIST	No	4	$24,638.80
1999-07-20	Severe Storm(s)	NORTH LAS VEGAS, CITY OF	No	9	$105,452.39
