Date	Incident Type	Applicant Name	Education Applicant	Number of Projects	Federal Share Obligated
1999-05-17	Severe Storm(s)	PINE DRIVE WATER DIST	No	1	$20,386.69
1999-05-17	Severe Storm(s)	PUEBLO, CITY OF	No	11	$157,388.63
1999-05-17	Severe Storm(s)	PUEBLO COUNTY	No	1	$11,627.69
1999-05-17	Severe Storm(s)	PUEBLO COUNTY, DEPT OF PUBLIC WORKS	No	10	$136,748.65
1999-05-17	Severe Storm(s)	PUEBLO COUNTY, HEALTH DEPARTMENT	No	1	$0.00
1999-05-17	Severe Storm(s)	PUEBLO COUNTY, WATER WORKS	No	1	$0.00
