Date	Incident Type	Applicant Name	Education Applicant	Number of Projects	Federal Share Obligated
2000-12-29	Severe Ice Storm	BEARDEN, CITY OF BEARDEN	No	2	$41,265.10
2000-12-29	Severe Ice Storm	CAMDEN, CITY OF CAMDEN	No	8	$1,271,522.79
2000-12-29	Severe Ice Storm	CAMDEN REGIONAL AIRPORT COMMISSION	No	1	$1,487.61
2000-12-29	Severe Ice Storm	CAMDEN WATER UTILITIES	No	1	$10,105.50
2000-12-29	Severe Ice Storm	CHIDESTER, CITY OF CHIDESTER	No	2	$2,388.38
2000-12-29	Severe Ice Storm	EAST CAMDEN (SHUMAKER PARK), CITY OF EAST CAMDEN	No	4	$30,504.80
2000-12-29	Severe Ice Storm	HARMONY GROVE SCHOOL DISTRICT	Yes	1	$391.95
2000-12-29	Severe Ice Storm	OUACHITA (COUNTY)	No	6	$2,418,154.14
2000-12-29	Severe Ice Storm	STEPHENS, CITY OF STEPHENS	No	3	$22,453.55
