Date	Incident Type	Applicant Name	Education Applicant	Number of Projects	Federal Share Obligated
2000-12-29	Severe Ice Storm	AMITY, CITY OF AMITY	No	3	$19,072.57
2000-12-29	Severe Ice Storm	ARKADELPHIA, CITY OF ARKADELPHIA	No	7	$339,164.37
2000-12-29	Severe Ice Storm	CADDO VALLEY, CITY OF CADDO VALLEY	No	4	$15,630.46
2000-12-29	Severe Ice Storm	CLARK (COUNTY)	No	9	$3,155,369.29
2000-12-29	Severe Ice Storm	CLARK COUNTY RIVER VALLEY WATER PUB FACILITIES BD	No	1	$1,037.88
2000-12-29	Severe Ice Storm	GUM SPRINGS, TOWN OF GUM SPRINGS	No	1	$4,937.67
2000-12-29	Severe Ice Storm	GURDON, CITY OF GURDON	No	5	$210,821.52
