Date	Incident Type	Applicant Name	Education Applicant	Number of Projects	Federal Share Obligated
2000-02-28	Flood	HUNDRED-LITTLETON PUBLIC SVC	No	1	$1,218.34
2000-02-28	Flood	NEW MARTINSVILLE	No	2	$10,900.78
2000-02-28	Flood	PINE GROVE VOLUNTEER FIRE DEPT	No	1	$2,190.05
2000-02-28	Flood	SMITHFIELD VOLUNTEER FIRE DEPARTMENT	No	1	$1,290.69
2000-02-28	Flood	TOWN OF PINE GROVE	No	4	$10,694.62
2000-02-28	Flood	WETZEL COUNTY BOARD OF EDUCATION	Yes	3	$8,496.97
2000-02-28	Flood	WETZEL COUNTY EMERGENCY SVC	No	1	$3,139.69
