Date	Incident Type	Applicant Name	Education Applicant	Number of Projects	Federal Share Obligated
2000-09-26	Severe Storm(s)	OHIO DEPARTMENT OF NATURAL RESOURCES	No	1	$5,471.96
2000-09-26	Severe Storm(s)	OHIO DEPARTMENT OF TRANSPORTATION  - CENTRAL OFFICE	No	2	$175,065.22
2000-09-26	Severe Storm(s)	OHIO EMERGENCY MANAGEMENT AGENCY	No	4	$39,095.25
2000-09-26	Severe Storm(s)	OHIO NATIONAL GUARD	No	1	$27,897.26
2000-09-26	Severe Storm(s)	OHIO STATE HIGHWAY PATROL, DEPT OF PUBLIC SAFETY	No	1	$2,680.47
