Date	Incident Type	Applicant Name	Education Applicant	Number of Projects	Federal Share Obligated
2001-06-17	Severe Storm(s)	BAY COUNTY	No	209	$2,554,008.48
2001-06-17	Severe Storm(s)	BEACH MOSQUITO CONTROL DISTRICT	No	2	$94,974.46
2001-06-17	Severe Storm(s)	CEDAR GROVE, CITY OF	No	5	$55,314.71
2001-06-17	Severe Storm(s)	MEXICO BEACH, CITY OF	No	1	$17,037.35
2001-06-17	Severe Storm(s)	PANAMA CITY BEACH, CITY OF	No	2	$7,851.53
2001-06-17	Severe Storm(s)	SPRINGFIELD, CITY OF	No	8	$55,512.88
