Date	Incident Type	Applicant Name	Education Applicant	Number of Projects	Federal Share Obligated
2003-11-21	Severe Storm(s)	COMMONWEALTH OF PUERTO RICO (GAR)	No	6	$518,840.08
2003-11-21	Severe Storm(s)	DEPARTMENT OF NATURAL & ENVIRONMENTAL RESOURCES	No	24	$341,484.93
2003-11-21	Severe Storm(s)	DEPARTMENT OF TRANSPORTATION AND PUBLIC WORKS	No	73	$632,278.17
2003-11-21	Severe Storm(s)	PR ELECTRIC POWER AUTHORITY	No	7	$112,278.71
2003-11-21	Severe Storm(s)	PR HIGHWAY AND TRANSPORTATION AUTHORITY	No	9	$55,743.63
2003-11-21	Severe Storm(s)	PR LAND AUTHORITY	No	19	$429,569.44
2003-11-21	Severe Storm(s)	PR NATIONAL GUARD	No	3	$250,920.88
2003-11-21	Severe Storm(s)	PUERTO RICO AQUEDUCT AND SEWER AUTHORITY	No	25	$165,715.54
2003-11-21	Severe Storm(s)	PUERTO RICO EMERGENCY MANAGEMENT AGENCY	No	4	$57,357.33
