Date	Incident Type	Applicant Name	Education Applicant	Number of Projects	Federal Share Obligated
2003-03-11	Snow	CONNECTICUT COMMUNITY COLLEGES	No	1	$65,426.42
2003-03-11	Snow	CONNECTICUT DEPARTMENT OF TRANSPORTATION	No	1	$2,379,339.38
2003-03-11	Snow	CT DEPT OF VETERANS AFFAIRS	No	1	$10,078.56
2003-03-11	Snow	CT OFFICE OF POLICY AND MANAGEMENT	No	1	$23,399.39
2003-03-11	Snow	DEPARTMENT OF MENTAL HEALTH & ADDICTION SERVICES	No	1	$27,121.18
2003-03-11	Snow	STATE OF CT - DEPT OF PUBLIC WORKS	No	1	$114,279.96
