Date	Incident Type	Applicant Name	Education Applicant	Number of Projects	Federal Share Obligated
2003-11-07	Severe Storm(s)	MASON, COUNTY OF, CLOSED	No	19	$527,206.91
2003-11-07	Severe Storm(s)	MASON COUNTY PUBLIC HOSPITAL DISTRICT `1, CLOSED	No	1	$2,437.13
2003-11-07	Severe Storm(s)	MASON COUNTY SHELTER, CLOSED	No	3	$2,095.80
2003-11-07	Severe Storm(s)	NORTH MASON SCHOOL DISTRICT, CLOSED	Yes	1	$0.00
2003-11-07	Severe Storm(s)	SHELTON, CITY OF, CLOSED	No	3	$11,346.84
2003-11-07	Severe Storm(s)	SKOKOMISH INDIAN TRIBE	No	6	$17,051.90
