Date	Incident Type	Applicant Name	Education Applicant	Number of Projects	Federal Share Obligated
2003-09-18	Hurricane	CAROLINA BEACH, TOWN OF	No	2	$32,154.39
2003-09-18	Hurricane	KURE BEACH, TOWN OF	No	2	$21,847.29
2003-09-18	Hurricane	NEW HANOVER COUNTY	No	2	$235,656.03
2003-09-18	Hurricane	NEW HANOVER COUNTY SCHOOL DIST	Yes	1	$1,869.48
2003-09-18	Hurricane	NEW HANOVER REGIONAL MEDICAL CENTER	No	2	$84,859.95
2003-09-18	Hurricane	UNIVERSITY OF NC AT WILMINGTON	Yes	2	$16,235.81
2003-09-18	Hurricane	WILMINGTON, CITY OF	No	2	$190,047.38
2003-09-18	Hurricane	WRIGHTSVILLE BEACH, TOWN OF	No	1	$20,198.79
