Date	Incident Type	Applicant Name	Education Applicant	Number of Projects	Federal Share Obligated
2003-08-23	Other	EPISCOPAL HEALTH SER./ST. JOHN'S EPISCOPAL HOS.	No	1	$4,652.05
2003-08-23	Other	FLUSHING HOSPITAL MEDICAL CENTER	No	1	$4,559.38
2003-08-23	Other	JAMAICA HOSPITAL MEDICAL CENTER	No	1	$12,063.40
2003-08-23	Other	MOUNT SINAI HOSPITAL OF QUEENS	No	1	$5,969.09
2003-08-23	Other	PARKER JEWISH INST. FOR HEALTH CARE & REHAB.	No	1	$5,602.77
2003-08-23	Other	PENINSULA HOSPITAL CENTER	No	1	$6,154.51
2003-08-23	Other	THE NY HOSPITAL MEDICAL CENTER OF QUEENS	No	1	$20,160.57
