Date	Incident Type	Applicant Name	Education Applicant	Number of Projects	Federal Share Obligated
2003-05-06	Severe Storm(s)	BLACKBURN ELMWOOD SPECIAL ROAD DISTRICT	No	1	$5,548.90
2003-05-06	Severe Storm(s)	GILLIAM SPECIAL ROAD DISTRICT	No	1	$8,072.84
2003-05-06	Severe Storm(s)	GRAND PASS SPECIAL ROAD DISTRICT	No	1	$4,014.36
2003-05-06	Severe Storm(s)	MALTA BEND SPECIAL ROAD DISTRICT	No	1	$10,965.86
2003-05-06	Severe Storm(s)	SALINE (COUNTY)	No	2	$11,667.57
2003-05-06	Severe Storm(s)	SLATER SPECIAL ROAD DISTRICT	No	1	$7,677.45
