Date	Incident Type	Applicant Name	Education Applicant	Number of Projects	Federal Share Obligated
2003-07-21	Severe Storm(s)	HOWARD GREELEY RURAL PUBLIC POWER DIST	No	3	$21,777.67
2003-07-21	Severe Storm(s)	MIDWEST ELECTRIC COOPERATIVE CORPORATION	No	1	$8,078.96
2003-07-21	Severe Storm(s)	NEBRASKA EMERGENCY MANAGEMENT AGENCY	No	4	$11,041.93
2003-07-21	Severe Storm(s)	NEBRASKA PUBLIC POWER DISTRICT	No	10	$214,731.15
2003-07-21	Severe Storm(s)	NORRIS PUBLIC POWER DISTRICT	No	2	$150,859.62
2003-07-21	Severe Storm(s)	NORTHEAST NEBRASKA PUBLIC POWER DISTRICT	No	2	$73,148.02
2003-07-21	Severe Storm(s)	OMAHA PUBLIC POWER DISTRICT	No	3	$787,624.90
2003-07-21	Severe Storm(s)	WHEAT BELT PPD	No	1	$5,045.57
