Date	Incident Type	Applicant Name	Education Applicant	Number of Projects	Federal Share Obligated
2004-01-15	Snow	CONNECTICUT COMMUNITY COLLEGES	No	1	$54,430.89
2004-01-15	Snow	CONNECTICUT DEPARTMENT OF TRANSPORTATION	No	6	$2,052,475.44
2004-01-15	Snow	CT DEPT OF VETERANS AFFAIRS	No	1	$8,493.13
2004-01-15	Snow	CT OFFICE OF EMERGENCY MANAGEMENT & HOMELAND SECURITY	No	2	$-37,199.50
2004-01-15	Snow	DEPARTMENT OF MENTAL HEALTH & ADDICTION SERVICES	No	1	$13,969.93
2004-01-15	Snow	STATE OF CT - DEPT OF PUBLIC WORKS	No	2	$97,442.14
