Date	Incident Type	Applicant Name	Education Applicant	Number of Projects	Federal Share Obligated
2004-06-03	Severe Storm(s)	PERRY (COUNTY) / HIGHWAY DEPT., HIGHWAY DEPT.	No	1	$89,024.13
2004-06-03	Severe Storm(s)	TELL CITY (CITY OF)	No	7	$105,156.55
2004-09-01	Severe Storm(s)	CANNELTON, CITY OF, UTILITIES	No	1	$1,863.47
2004-09-01	Severe Storm(s)	PERRY COUNTY HIGHWAY DEPARTMENT	No	1	$20,103.72
2004-09-01	Severe Storm(s)	TELL CITY, CITY OF	No	2	$26,118.36
2004-09-01	Severe Storm(s)	TELL CITY, CITY OF, ELECTRIC DEPARTMENT	No	1	$22,023.99
2004-09-01	Severe Storm(s)	TROY, TOWN OF, ELECTRIC UTILITY	No	1	$4,009.87
