Date	Incident Type	Applicant Name	Education Applicant	Number of Projects	Federal Share Obligated
2005-10-24	Hurricane	EASTER SEALS	No	3	$2,707.94
2005-10-24	Hurricane	JUPITER ISLAND, TOWN OF	No	12	$710,212.78
2005-10-24	Hurricane	MARTIN COUNTY	No	98	$10,911,297.62
2005-10-24	Hurricane	MARTIN COUNTY SCHOOL DISTRICT	Yes	36	$882,508.46
2005-10-24	Hurricane	MARTIN COUNTY SHERIFF'S OFFICE	No	5	$453,061.02
2005-10-24	Hurricane	MARTIN MEMORIAL HEALTH SYSTEMS, INC.	No	15	$217,934.68
2005-10-24	Hurricane	SEWALL'S  POINT,  TOWN OF	No	7	$246,281.10
2005-10-24	Hurricane	STUART, CITY OF	No	27	$1,029,754.46
