Date	Incident Type	Applicant Name	Education Applicant	Number of Projects	Federal Share Obligated
2005-11-08	Typhoon	ROTA (MUNICIPALITY), DEPT. OF COMMUNITY AND CULTURAL AFFAIRS	No	1	$5,067.96
2005-11-08	Typhoon	ROTA (MUNICIPALITY), DEPT. OF FINANCE	No	1	$1,936.60
2005-11-08	Typhoon	ROTA (MUNICIPALITY), DEPT. OF PUBLIC SAFETY	No	1	$24,915.58
2005-11-08	Typhoon	ROTA (MUNICIPALITY), DEPT. OF PUBLIC WORKS	No	2	$16,214.00
2005-11-08	Typhoon	ROTA (MUNICIPALITY), OFFICE OF THE MAYOR	No	1	$9,534.85
2005-11-08	Typhoon	ROTA (MUNICIPALITY), ROTA HEALTH CENTER	No	1	$7,312.88
