Date	Incident Type	Applicant Name	Education Applicant	Number of Projects	Federal Share Obligated
2006-05-02	Snow	CONNECTICUT COMMUNITY COLLEGES	No	1	$43,748.09
2006-05-02	Snow	CONNECTICUT DEPARTMENT OF TRANSPORTATION	No	6	$2,505,704.07
2006-05-02	Snow	CONNECTICUT DEPARTMENT OF TRANSPORTATION, BUREAU OF AVIATION AND PORTS	No	1	$161,380.90
2006-05-02	Snow	CT COMMISSION ON FIRE PREVENTION & CONTROL	No	1	$2,060.72
2006-05-02	Snow	CT DEPARTMENT OF CORRECTION	No	1	$71,508.17
2006-05-02	Snow	CT - DEPT OF PUBLIC WORKS	No	1	$115,894.19
2006-05-02	Snow	CT DEPT OF VETERANS AFFAIRS	No	1	$4,315.46
2006-05-02	Snow	CT OFFICE OF EMERGENCY MANAGEMENT & HOMELAND SECURITY	No	1	$-83,340.07
2006-05-02	Snow	DEPARTMENT OF MENTAL HEALTH & ADDICTION SERVICES	No	1	$13,910.59
