Date	Incident Type	Applicant Name	Education Applicant	Number of Projects	Federal Share Obligated
2006-03-20	Severe Storm(s)	CAVE JUNCTION (CITY OF)	No	1	$1,958.83
2006-03-20	Severe Storm(s)	GRANTS PASS (CITY OF)	No	3	$16,926.65
2006-03-20	Severe Storm(s)	GRANTS PASS IRRIGATION DISTRICT	No	11	$115,352.12
2006-03-20	Severe Storm(s)	JOSEPHINE COUNTY PARKS	No	4	$12,158.35
2006-03-20	Severe Storm(s)	JOSEPHINE COUNTY PROPERTY SERVICES	No	14	$65,825.72
2006-03-20	Severe Storm(s)	JOSEPHINE COUNTY SHERIFF	No	1	$1,887.06
2006-03-20	Severe Storm(s)	THREE RIVERS SCHOOL DISTRICT	Yes	4	$48,982.73
