Date	Incident Type	Applicant Name	Education Applicant	Number of Projects	Federal Share Obligated
2007-05-01	Severe Storm(s)	BUFFALO CREEK PUBLIC SERVICE DISTRICT	No	1	$6,497.45
2007-05-01	Severe Storm(s)	CHAPMANVILLE VOLUNTEER FIRE DEPARTMENT	No	1	$5,201.34
2007-05-01	Severe Storm(s)	LOGAN CITY FIRE DEPARTMENT	No	1	$3,268.20
2007-05-01	Severe Storm(s)	LOGAN (COUNTY)	No	1	$6,994.20
2007-05-01	Severe Storm(s)	LOGAN COUNTY PUBLIC SERVICE DISTRICT	No	17	$43,009.97
2007-05-01	Severe Storm(s)	VERDUNVILLE VOLUNTEER FIRE DEPARTMENT	No	1	$1,756.80
