Date	Incident Type	Applicant Name	Education Applicant	Number of Projects	Federal Share Obligated
2007-05-16	Severe Storm(s)	COMMONWEALTH OF MASSACHUSETTS HIGHWAY DEPARTMENT	No	7	$71,450.47
2007-05-16	Severe Storm(s)	DEPARTMENT OF HOUSING AND COMMUNITY DEVELOPMENT	No	3	$79,167.76
2007-05-16	Severe Storm(s)	DEPARTMENT OF STATE POLICE	No	1	$11,798.95
2007-05-16	Severe Storm(s)	DEPT. OF CONSERVATION & RECREATION STATE PKS	No	33	$816,444.29
2007-05-16	Severe Storm(s)	DEPT. OF ENVIRONMENTAL LAW ENFORCEMENT	No	1	$3,682.36
2007-05-16	Severe Storm(s)	MASSACHUSETT EMERGENCY MANAGEMENT AGENCY	No	1	$19,235.94
2007-05-16	Severe Storm(s)	MASSACHUSETTS DEPARTMENT OF CORRECTION	No	1	$4,507.43
2007-05-16	Severe Storm(s)	MILITARY DIVISION	No	1	$85,127.58
2007-05-16	Severe Storm(s)	THE STEAMSHIP AUTHORITY	No	2	$13,896.75
