Date	Incident Type	Applicant Name	Education Applicant	Number of Projects	Federal Share Obligated
2007-07-02	Severe Storm(s)	BOURBON COUNTY	No	7	$136,343.41
2007-07-02	Severe Storm(s)	BOURBON COUNTY EMERGENCY PREP	No	3	$2,198.32
2007-07-02	Severe Storm(s)	CONSOLIDATED RURAL WATER DISTRICT 2	No	3	$44,022.56
2007-07-02	Severe Storm(s)	FORT SCOTT, CITY OF	No	3	$16,522.45
2007-07-02	Severe Storm(s)	MARMATON WATERSHED JOINT DISTRICT NO. 102	No	3	$43,772.97
2007-07-02	Severe Storm(s)	MILL CREEK WATERSHED DISTRICT NO. 98	No	1	$2,383.13
