Date	Incident Type	Applicant Name	Education Applicant	Number of Projects	Federal Share Obligated
2008-09-02	Hurricane	PLAQUEMINES MEDICAL CTR HOSPITAL SER DIST 1	No	2	$12,107.86
2008-09-02	Hurricane	PLAQUEMINES (PARISH)	No	41	$8,599,223.05
2008-09-02	Hurricane	PLAQUEMINES PARISH SCHOOL BOARD	Yes	16	$76,822.62
2008-09-02	Hurricane	PLAQUEMINES PARISH SHERIFF OFC	No	3	$1,018,646.98
2008-09-13	Hurricane	PLAQUEMINES (PARISH)	No	29	$21,645,114.27
2008-09-13	Hurricane	PLAQUEMINES PARISH SCHOOL BOARD	Yes	1	$1,489.50
2008-09-13	Hurricane	PLAQUEMINES PARISH SHERIFF OFC	No	5	$1,260,062.30
