Date	Incident Type	Applicant Name	Education Applicant	Number of Projects	Federal Share Obligated
2008-10-08	Severe Storm(s)	BRUNSWICK ELECTRIC MEMBERSHIP CORPORATION	No	2	$219,359.86
2008-10-08	Severe Storm(s)	DEPT OF JUSTICE STATE BUREAU OF INVESTIGATION	No	1	$1,595.39
2008-10-08	Severe Storm(s)	NC DEPARTMENT OF AGRICULTURAL & CONSUMER SVCS	No	1	$3,501.37
2008-10-08	Severe Storm(s)	NC DEPARTMENT OF TRANSPORTATION	No	5	$1,046,837.35
2008-10-08	Severe Storm(s)	NC DIVISION OF EMERGENCY MANAGEMENT	No	4	$277,543.70
2008-10-08	Severe Storm(s)	NC DIVISION OF FOREST RESOURCES	No	1	$2,941.04
2008-10-08	Severe Storm(s)	NC NATIONAL GUARD	No	1	$84,356.29
2008-10-08	Severe Storm(s)	PIEDMONT ELECTRIC MEMBERSHIP CORPORATION	No	2	$6,447.52
