Date	Incident Type	Applicant Name	Education Applicant	Number of Projects	Federal Share Obligated
2011-03-23	Severe Storm(s)	BARNETT SPECIAL ROAD DISTRICT	No	1	$2,784.16
2011-03-23	Severe Storm(s)	GRAVOIS FIRE PROTECTION DIST	No	1	$1,964.77
2011-03-23	Severe Storm(s)	GRAVOIS SPECIAL  ROAD DISTRICT 8	No	1	$3,625.31
2011-03-23	Severe Storm(s)	MORGAN (COUNTY)	No	1	$38,909.72
2011-03-23	Severe Storm(s)	MORGAN COUNTY R-II SCHOOL DISTRICT	Yes	1	$1,462.50
2011-03-23	Severe Storm(s)	VERSAILLES	No	1	$12,110.87
