Date	Incident Type	Applicant Name	Education Applicant	Number of Projects	Federal Share Obligated
2011-06-23	Severe Storm(s)	GILL TOWNSHIP LEVEE ASSOCIATION	No	3	$43,652.53
2011-06-23	Severe Storm(s)	ISLAND LEVEE CONSERVANCY DISTRICT	No	4	$15,222.28
2011-06-23	Severe Storm(s)	MEROM	No	2	$2,937.29
2011-06-23	Severe Storm(s)	SULLIVAN CITY STREET DEPARTMENT	No	5	$29,844.06
2011-06-23	Severe Storm(s)	SULLIVAN COUNTY EMERGENCY MANAGEMENT AGENCY	No	2	$956.66
2011-06-23	Severe Storm(s)	SULLIVAN COUNTY HIGHWAY DEPARTMENT	No	17	$244,839.28
2011-06-23	Severe Storm(s)	SULLIVAN COUNTY PARKS & RECREATION	No	4	$23,284.05
