Date	Incident Type	Applicant Name	Education Applicant	Number of Projects	Federal Share Obligated
2011-07-22	Severe Storm(s)	HIGH PLAINS POWER, INC.	No	1	$1,761.48
2011-07-22	Severe Storm(s)	LOWER VALLEY ENERGY	No	4	$642,712.40
2011-07-22	Severe Storm(s)	SHOSHONE ARAPAHO JOINT BUSINESS COUNCIL	No	2	$167,170.93
2011-07-22	Severe Storm(s)	WYOMING DEPT OF TRANSPORTATION	No	3	$47,215.94
2011-07-22	Severe Storm(s)	WYOMING GAME AND FISH DEPARTMENT	No	2	$13,326.64
2011-07-22	Severe Storm(s)	WYOMING OFFICE OF HOMELAND SECURITY	No	6	$697,265.77
2011-07-22	Severe Storm(s)	WYOMING STATE PARKS, HISTORIC SITES & TRAILS	No	21	$310,139.74
